{
  "bag_path": "tomato_bag",
  "git_hash": "aaaaaaaaaaaaaaaaaaaaaaaaaaaaaaaaaaaaaaaa",
  "git_branch": "dev",
  "hsr_id": "hsrc50",
  "location_name": "lab1",
  "interface": "remote_control",
  "interface_git_hash": "bbbbbbbbbbbbbbbbbbbbbbbbbbbbbbbbbbbbbbbb",
  "interface_git_branch": "dev",
  "instructions": [
    [
      "Pick up the tomato."
    ],
    [
      "Place tomato in basket."
    ],
    [
      "Verify placement."
    ]
  ],
  "segments": [
    {
      "start_time": 0,
      "end_time": 5,
      "instruction_index": 0,
      "has_suboptimal": false,
      "is_directed": true
    },
    {
      "start_time": 6,
      "end_time": 15,
      "instruction_index": 1,
      "has_suboptimal": false,
      "is_directed": true
    },
    {
      "start_time": 16,
      "end_time": 25,
      "instruction_index": 2,
      "has_suboptimal": false,
      "is_directed": true
    }
  ]
}
